ID;leftContext;node;rightContext;truth
1;, and diaconas , and clericas , and dæghwamlice mid him Godes lof gefylde mid gastlicum sangum . On ðære byrig wæs sum þegn Bonifacius gehaten , se wearð færlice dumb , and his wif þa asende to þam halgan bisceope , and bæd his geneosunge . Efne ða se;bisceop;"eode to his huse , and an wifman wæs ðær wod on his huse , and se deofol clypode and cwæð þurh þone wodan to ðam halgan bisceope , ic gedo þæt man gebint ðe , handum and fotum , and heonon ðe swa tihð of þysre byrig ; and";singular
2;, and he wearð hal sona , mid þam ðe he clypode Cristes naman him to fultume . Þa awearp se gehæleda his hæðenscype him fram , and gelyfde on ðone hælend , and mid geleafan wearð gefullod . Hit gelamp þa æfter fyrste þæt þa ungeleaffullan hæðenan gebundon þone;bisceop;, and to ðære byrig Rauenna geleddon on bendum , and beoton hine wodlice . Ða gebæd hine se bisceop bealdlice to Gode , and heora deofolgild wearð towend , and heora templ toworpen . Þa gesawon ða hæðenan þæs halgan weres mihte , and clypodon mid gehlyde , be;singular
3;", and heo wearð forgifen Ecfride cynincge , and twelf gear wunode ungewemmed mæden on þæs cynincges synscype , swa swa swutele wundra hyre mærða cyðaþ , and hire mægðhad gelome . Heo lufode þone hælend þe hi heold unwemme , and Godes ðeowas wurðode ; an þæra wæs Wilfrid";bisceop;þe heo swyðost lufode , and he sæde Bedan þæt se cyning Ecfrid him oft behete mycel on lande and on feo , gif he læran mihte Æðeldryðe his gebeddan , þæt heo bruce his synscipes . Nu cwæð se halga Beda þe þas boc gesette þæt se ælmihtiga God;singular
4;, and þæra halgena siðfæt is gegearcod . Þes bisceop worhta fæla wundra þuruh God , and him wearð geswutelod on swæfne be þysum , and eall þæs mædenes mod him wearð ameldod . Ða gespræc þæt mæden sumne messepreost , Eutropius gehaten , þæt he hyre ærende abude þam;bisceope;þysum wordum geornlice , we ðry gebroðra wyllað gecyrran fram þam fulan hæðenscype to hælende Criste , and we nellað nateshwon us næfre totweman . Þa þæs on mergen se mæssepreost abead þæs mædenes word þam mæron bisceope . Þa het se bisceop hi gelangian , mycclum þanciende þam ælmihtigan;singular
5;, ne wifmen ne beon butan sidefulnysse , ne se hlaford ne beo leas on wordum , ne nan cristen man ne sceal sceandlice flitan . Eft bið swiðe þwyrlic , þæt ðearfa beo modig , and forcuðlic hit bið þæt cyning beo unrihtwis . Eac bið swyþe derigendlic þæt;bisceop;beo gymeleas , and unfremful bið þæt folc beo butan steora , oððe butan æ , him eallum to hearme . Þissere worulde hæl is þæt heo witan hæbbe , and swa ma witena beoð on bradnysse middaneardes , swa hit bet færð æfter ðæs folces þearfa . Ne bið;singular
6;, on Abrahames wisan . Þa on sumne sæl gelamp hit for heora synnum , swaþeah , þæt þa hæþenan fuhton on þam folce sige , and arcam domini gelæhtan þæt is Drihtnes scrin , on þam scrine wæs gehealden se heofonlica mete , and Aarones gyrd , þæs æreston;bisceopes;, and Moyses tabulan , þe on þam munte wæron mid Godes fingre awritene , his folce to lare . Þa ferodon þa hæþenan þæt foresæde scrin mid þam heofonlican haligdome ham to heora temple , and settan hit þa arwurðlice up to heora gode , se god hatte Dagon;plural
7;, þa habbað þa ecean reste and unawendendlice welan . Hwæt ða Demosten deoflice wearð gehathyrt , and betæhte þone halgan sumum hundredes ealdre to healdenne on cwearterne oðþæt he hine acwealde . Se hundredes ealdor wæs ðam hæðenan bediglod , and wæs digellice cristen , and cwæð to þam;bisceope;", min fæder , ic ðe bidde , ne beo þu swa hræd to deaðe , forðan þe us is þin lif nydbehefe git ; ac far þe nu digellice þær ðu frið hæbbe , oþþæt ðises folces hatheortnyss hwæthwega beo gestylled . He eode ða nihtes þæt he his";singular
8;, þaða se cristendom wæs wel ðeonde þurh God on Angelcynne under ðam ylcan cynincge , þa geswutelode God þone sanct Swyðun mid manegum wundrum , þæt he mære is . His dæda næron cuðe ærðan þe hi God sylf cydde , ne we ne fundon on bocum hu se;bisceop;"leofode on þysre worulde , ærðan þe he gewende to Criste . Þæt wæs þæra gymeleast þe on life hine cuþon , þæt hi noldon awritan his weorc and drohtnunge þam towerdum mannum ðe his mihte ne cuðon ; ac God hæfð swa þeah his lif geswutelod , mid swutelum";singular
9;, þæt he hyre ærende abude þam bisceope þysum wordum geornlice , we ðry gebroðra wyllað gecyrran fram þam fulan hæðenscype to hælende Criste , and we nellað nateshwon us næfre totweman . Þa þæs on mergen se mæssepreost abead þæs mædenes word þam mæron bisceope . Þa het se;bisceop;hi gelangian , mycclum þanciende þam ælmihtigan Gode þæt he wolde him onwreon þæs mædenes wyllan . He genam hi þa onsundron and sæde hyre gewislice hwæt heo man ne wæs , and hwylcere mægþe , and þæt heo þurh mægðhad mycclum gelicode þam heofonlican cyninge þe heo gecoren hæfde;singular
10;. Þa dydon hi sona swa , and sungon þone lofsang , oðþæt heom laðode eallum þæt hi swa oft arisan , hwilon þrywa on niht , hwilon feower syðum , to singenne þone lofsang þonne hi slapan sceoldon , and forleton ealle endemes þone sang , forðam þe se;bisceop;wæs bysig mid þam cynincge , and nyste butan hi sungon þone lofsang forð on . Hwæt ða se halga Swyðun sylf com on swefne wundorlice geglencged to sumum godan menn and cwæð , Gang nu to ealdan mynstre , and þam munecum sege þæt Gode swyðe oflicað heora ceorung;singular
11;"; ac him gebyrede swa ðeah þæt feorh earfoðlice . Us sæde eac oft Aþelwold , se halga bisceop þe nu wyrcð wundra ðurh God , þæt he cuðe anne mann mid Ælfege bisceope , se wolde drincan on Lenctene þonne hine lyste . Þa sume dæg bæd he þone";bisceop;Ælfeh blætsian his ful . He nolde , and se dysiga dranc butan bletsunge and eode him ut . Man slætte þa ænne fearr feringa þærute , and se fear arn him togeanes , and hine ðyde þæt he his feorh forlet , and gebohte swa ðone untiman drenc .;singular
12;"; and hine sohton þa cristenan , and his lare hlyston mid geleafan georne ; and ealle ða untruman þe him oft to comon wurdon gehælede , and ham gesunde cyrdon . Þa sendon ða hæðengildan mid hetelicum geðance ærende to þam casere , þæt he acwellan hete þone halgan";bisceop;, þæt heora biggencgas ne wurdon mid ealle adwæscte þurh ðone Drihtnes bydel . Ða sende se casere sona him þis gewrit , Gif ænig man gremige ure godas dyrstiglice , gebete he wið hi oððe he beo adræfed awæg of ðære byrig , forðan þe hit ne bið na;singular
13;"; and þa cwæð se sacerd , hwæt tæcst þu nu to ræde ? And he him hraþe andwyrde , ne mot ic nateshwon into þære stowe faran buton ic hæbbe leafe þæs halgan Gregories . Þa macode se sacerd his fare on mergen ofer langne weg to þam geleaffullan";biscope;, and his fet gesohte , his sið bemænende , þæt his bigleofa moste mid ealle him losian , for þam þe he afligde færlice mid his tocyme þone god þe he wurðode of his gewunelican stowe . Ða awrat Gregorius þis gewrit to þam gode : ic grete þe;singular
14;? Gewit aweg , gewit , þe læs þe þe gewurðe þin anwilnyss to deopran synne . Underfoh þone bend þe ure Drihten geband : he is se mæsta læcedom þinre manfullan dæde . Þa wiste se casere wel hwæt he mænde , þæt he sylf wære gebunden þurh þæs;biscopes;"hæse , and fram Godes cyrcan ascyred swa wære oðþæt se bisceop hyne unbunde eft ; and he wæs þa gehyrsum hys hæsum sona , gewende þa swa ham dreoriglice heofigende . He sæt þa on hys bure biterlice wepende eahta monðas fullice for hys misdæde , þæt he næfre";singular
15;"ac ða þæ of Gode synd acennede . And þæt Word is geworht flæsc &amp; hit wunode on us . And we sylfe gesawon soðlice his wuldor , swylc wuldor swa gedafenað Godes ancennedan Suna , eall fulne mid gyfe &amp; mid soðfæstnysse . Augustinus se wisa &amp; se wordsnotera";bisceop;"sæde þæt he ne mihte :text_missing *yc:text_missing+> gehyran þonne he him sylf wæs embe þæt halige godspell for þære micclan deopnysse þæs diglan andgites . Ac he asmeade þeah hwæðre sume þa getacnunge þurh Godes sylfes fultum þæs :text_missing &amp; be his onwrigenysse we hit awritað on engliscre spræce .";singular
16;and ealle his gegadan , Gode to forsewennysse , ælc his recelsfæt ætforan Godes getelde , and ontendon þone stor , swa swa man steran sceal , swylce hi mihton hi sylfe gewyrcan Gode to sacerdon , buton he sylf hi gecure , swa swa Aaron wæs , se arwurða;bisceop;, þone þe God sylf geceas , and gesette him to bisceope on þa ealdan wisan æfter Moyses æ . Mid þam þe hi ðus dydon mid dyrstigon anginne , þa ætiwde þær sona gesewenlice Godes wuldor , and God cwæð to Moysen , Gað him fram hraðe . And;singular
17;and he clænlice lyfode syððan of þam dæge on swiðlicre forhæfdnysse , and ealle woruldþing forlet , and wunode mid þam bisceope . He wearð þa gefullod , and swa fullfremedlice þeah on halgum mægnum , mid micclum geleafan , and on Godes lare , þæt he æfter Gregorie to;biscope;"wearð gehalgod , and geheold wislice þone biscophad mid godre gebysnunge , Gode to gecwemednysse , swa swa us cyðað bec ; and ures Drihtnes geleafa adwæscte þæt hæþengild , for þan þe se cristendom com gehwær and þær . Oft sædon þa hæþenan þæt ure hælend Crist come æfter";singular
18;"and hire modor samod , and eall heora hired samod , sume þreo hund manna ; and fela ðæra hæðenra fengon to geleafan . Se fæder swa ðeah Rufus , for þæs caseres reðnysse , ne dorste geopenian þæt he on Drihten gelyfde , ac he digellice lufode þone geleaffullan";bisceop;, and mid wistum him þenode , and his dohtor wearð gehadod to Godes ðeowdome , and þurhwunode mæden . Appollonaris þa wearð gewreged to þam casere and to witnunge gelæd , and on þam witum geandette þæs hælendes naman , and sum hæðen mann þe him swyðost onwann awedde;singular
19;"and mid his ræde gehyrte eallum onlocigendum , þe ðær on ymbhwyrfte wæron . Hwæt ða on þone feorðan dæg het se foresæda dema gelædan ðone halgan on heardre racenteage , feorr on wræcsið ferigende on scipe . Þær wæs sum æðelboren man , atelice hreoflig ; þa axode se";bisceop;", wylt ðu beon hal ? He cwæð , ic wylle ; and him andwyrde se halga bisceop , Gelyf on hælend Crist ; and se hæðena him andwyrde , gif he me gehælð he bið min hælend God . Appollonaris ða hrepode þone untruman hreoflian on ðæs hælendes naman";singular
20;"and oðrum manegum spræcum , gewat se halga wer of worulde to Gode , mid þam he a wunað on þære ecean eadignysse ; and his leorningcnihtes ledon his lic arwurðlice on ane stænene þruh , and seo stod wið þone weall . Twam læs ðryttig geara he wæs heora";bisceop;"on manegum ehtnyssum , þam ælmihtigan þeowigende , and his edlean bið nu endeleas forðy mid þam ælmihtigan Gode , þe on ecnysse rixað ; AMEN . </doc><doc filename=coaelive.o3 period=o3 shorttitle=ÆLS_[Abdon_and_Sennes]> III. KAL. AUGUSTI . NATALIS SANCTORUM ABDON ET SENNES . On Decies dagum ðæs deoflican caseres wæron twegen kyningas on Crist gelyfde ,";
21;and sume hys gerefan oftorfodan mid stanum . Þa wearð se casere þearle gegremod , and asende his here to þære heafodbyrig , het ealle ofslean þa ceastergewaran , ge scyldige ge unscyldige for hys foresewennysse , and man ofsloh þær þa seofon þusenda manna . Ða wæs sum mære;biscop;, Ambrosius gehaten , on Mediolanabyrig , swiðe breme lareow and swiðe anræde mann . Þa ofahsode he þiss , and he swiðe bemænde þæt se mæra casere swylce dæde gedyde ongean hys Drihten . Hit gelamp þa siððan æfter lytlum fæce þæt se casere com mid hys cempum farende;
22;anræde mann . Þa ofahsode he þiss , and he swiðe bemænde þæt se mæra casere swylce dæde gedyde ongean hys Drihten . Hit gelamp þa siððan æfter lytlum fæce þæt se casere com mid hys cempum farende to Mediolanabyrig , wolde hyne gebiddan æt þam biscopstole , ac se;biscop;"eode ut hym togeanes and forwyrnde hym innganges . Ambrosius hym cwæð to : eala þu casere , nast þu þa micelnysse þæra manna sleges þe ðu gefremodest þurh þine reðnysse , ne þin mod ne oncnæwð þone micclan hefe þinre dyrstignysse þe þu gedon hæfst ; oððe hwæþer þin";
23;anwilnyss to deopran synne . Underfoh þone bend þe ure Drihten geband : he is se mæsta læcedom þinre manfullan dæde . Þa wiste se casere wel hwæt he mænde , þæt he sylf wære gebunden þurh þæs biscopes hæse , and fram Godes cyrcan ascyred swa wære oðþæt se;bisceop;"hyne unbunde eft ; and he wæs þa gehyrsum hys hæsum sona , gewende þa swa ham dreoriglice heofigende . He sæt þa on hys bure biterlice wepende eahta monðas fullice for hys misdæde , þæt he næfre ne geswac þære sorhfullan geomrunge oðþæt hit genealæhte þæs hælendes gebyrdtide to";
24;aweg , and eft cuman ne mihte into his anlicnysse , butan Gregorius him lyfde . La hu ne is forðy Gregorius betera þonne þes min god sy ? He beleac þa his tempel , mid geleafan onbryrd , and ferde eft ongean mid þam ilcan gewrite to þam arwurðan;biscope;, and him ealle asæde be his godes geancyme , and be his modes smeaunge , and feoll to his fotum , fulluhtes biddende , and þæt he hine betæhte þam heofonlican Gode , þurh þæs mihte þe he afligde þæra hæþenra godas . He bæd þa swa lange mid;
25;awende heora gewunelican ðeawas , and heora goda offrunga mid ealle adwæscte . Þa ferde se godspellere fram ðære byrig , to ðam geleaffullum ðe he ær lærde , and ðær þurhwunode wel twa gear mid him , and getrymede ða gebroðra ðe he ær to Gode gebigde and þær;bisceopas;gehadode , and halige preostas , and ferde eft ongean to Alexandrian byrig , and gemette þær fela gemenigfealde on geleafan , and on Godes gife ðeonde and he ðæs þancode Gode . Hi hæfdon eac aræred on hrædincge ane cyrcan , and weox se geleafa , and Godes wuldor;
26;axum hi sylfe bestreowodon , and mid hæran hi gescyrddon to lice . Nu do we þis lytle on ures Lenctenes anginne , þæt we streowiað axan uppan ure heafda to geswutelunge þæt we sculon ure synna behreowsian , on ure lenctenlicum fæstene . Sum ungerad mann wæs mid Ælfstane;bisceope;"on Wiltunscire on hirede ; se man nolde gan to ðam axum on þone Wodnes dæg , swa swa oðre men dydon þe þa mæssan gesohton . Þa bædon his geferan þæt he eode to þam mæssepreoste , and underfæncge þa gerynu þe hi underfengon . He cwæð , ic";
27;Basilla mid blysse hi underfæng , and deges and nihtes mid þam deorwurðum halgum Godes lare beeode , and hyre gebæda ne geswac oððæt Cornelius , þæra cristenra biscop , hi dearnunga gefullode fram eallum fulnyssum . Þa wurdon gelome þa leofan mædenu Eugenia and Basilla , and eac se;biscop;, on sunderspræce swiðe gebysgode , and digellice on nihtum hi symble geneosodon and hæfdon heora gerihtu mid þam halgen biscope . Þurh ðas twa mædena manega oðre becoman to Cristes geleafan , and to clænre drohtnunge . Ðurh Claudian becoman eac clæne wudewan mid godum wyllan to Godes geleafan;
28;"be þæs Hælendes godcundnysse , swa swa se earn sceawað þære sunnan leoman unateorigendum eagum ofer eallum nytenum . Ða þry oðre godspelleras awriton heora godspell be Cristes menniscnysse , hu he to mannum com , &amp; eac be þam wundrum þe he geworhte on life . Ða bædon þa";bisceopas;"binnan Asian lande þone halgan Iohannem þæt he him awrite sume gewissunge be þæs Hælendes godcundnysse . And he him bead þa þreora daga fæsten , &amp; æfter þam fæstene he wearð swa afylled mid þam Halgan Gaste þæt he ongann to writenne þa halgan Cristesboc swa swa we her";
29;bebyrged , and him læg onuppan fela byrðena eorðan binnon seofon nihton , þæs ðe he forsoc þa feawa axan . On þære ylcan wucan com sum truð to þæs bisceopes hirede , se ne gymde nanes lenctenes fæstenes , ac eode him to kicenan , þa hwile ðe se;bisceop;"mæssode , and began to etenne . He feoll þa æt ðære forman snæde underbecc geswogen , and spaw blod ; ac him gebyrede swa ðeah þæt feorh earfoðlice . Us sæde eac oft Aþelwold , se halga bisceop þe nu wyrcð wundra ðurh God , þæt he cuðe anne";
30;"began to etenne . He feoll þa æt ðære forman snæde underbecc geswogen , and spaw blod ; ac him gebyrede swa ðeah þæt feorh earfoðlice . Us sæde eac oft Aþelwold , se halga bisceop þe nu wyrcð wundra ðurh God , þæt he cuðe anne mann mid Ælfege";bisceope;, se wolde drincan on Lenctene þonne hine lyste . Þa sume dæg bæd he þone bisceop Ælfeh blætsian his ful . He nolde , and se dysiga dranc butan bletsunge and eode him ut . Man slætte þa ænne fearr feringa þærute , and se fear arn him togeanes;
31;"betæhte þam heofonlican Gode , þurh þæs mihte þe he afligde þæra hæþenra godas . He bæd þa swa lange mid geleafan þone bisceop þæt he hine cristnode ; and he clænlice lyfode syððan of þam dæge on swiðlicre forhæfdnysse , and ealle woruldþing forlet , and wunode mid þam";bisceope;. He wearð þa gefullod , and swa fullfremedlice þeah on halgum mægnum , mid micclum geleafan , and on Godes lare , þæt he æfter Gregorie to biscope wearð gehalgod , and geheold wislice þone biscophad mid godre gebysnunge , Gode to gecwemednysse , swa swa us cyðað bec;
32;boda heom be þam hælende , and ne beo ðu afyrht . Swutollice ðu wast þæt se is soð Godes sunu , se ðe seðe deadum forgeaf lif æfter deaðe , and wanhalum mannum mid his worde læcedom . Æfter ðysum wordum se eadiga Petrus gehadode Apollonarem and gehalgode to;bisceope;", and his handa sette ofer his heafod and cwæð , Asende ure hælend Crist his halgan engel mid þe , se geforðige ðe , and þine fare gewissige , and þe getiþige þæs ðe þu gewilnige ; and hine swa sende to ðære byrig mid siblicum cosse . Appollonaris";
33;bær forð , swa þæt þæt spere him eode þurh ut , and he feoll cwelende . He wearð ða bebyrged , and him læg onuppan fela byrðena eorðan binnon seofon nihton , þæs ðe he forsoc þa feawa axan . On þære ylcan wucan com sum truð to þæs;bisceopes;"hirede , se ne gymde nanes lenctenes fæstenes , ac eode him to kicenan , þa hwile ðe se bisceop mæssode , and began to etenne . He feoll þa æt ðære forman snæde underbecc geswogen , and spaw blod ; ac him gebyrede swa ðeah þæt feorh earfoðlice .";
34;casere sona geyrsod , and bebead Philippe þæt he buge to his godum , oððe wære benæmed wurðscipes and æhta . Þa dælde Philippus digollice his æhta geond ealle þa scyre cyrcum and þearfum , and þurh mycelne geleafan manega oðre getrymode , swa þæt ða cristenan hine gecuron to;bisceope;. Ða æfter twælf monðum gemunde se casere hwæt him gesæd wæs and sænde fram Rome oðerne gerefan mid reðum bebode , swa þæt he het acwellan þone cristenan Philippum , gif hit soð wære swa him gesæd wæs . Ða com se gerefa and hine acwællan ne dorste on;
35;Crist wolde on his tocyme clænnysse aræran , and his halgan hired heold on clænnysse . Menn hæfdon on frymðe heora magan to wife , and swa wel mosten for ðære wifleaste , and gif nu hwa swa deð næfð he Godes bletsunge . Under Moyses æ , moste se;bisceop;habban an geæwnod wif , for þære gewissan æftergencgnysse , þæt is þæt se sunu sceolde symle fon to þam hade , æfter his fæder geendunge and nan oðer ne moste . Hit mihte þa wel swa beon :emendation_from_ms.B , for þan þe hi ne mæssodon næfre , ac hi;
36;"Cristen folc þe on Crist gelyfð , swa swa Paulus cwæð on sumum his pistole to þam geleaffullum mannum þe he to geleafan gebigde : Dei agricultura estis , Dei edificatio estis ; þæt is on Englisc , Ge synd Godes tilung and Godes getimbrung . Witað nu þis :";Biscopas;"and mæssepreostas syndon manna lareowas ; hi sceolan hogian ymbe þæs Hælendes tilunge , þæt hi manega sawla of manncynne gestrynan þam welwillendan Hælende , þe wile us habban . Hi sceolon þone Cristendom don Cristes folce , and mid heora lare symle to geleafan weman , and æfre mid";
37;"cucu geond þreora daga fæc and gefrefrode þa cristenan , and swa mid martyrdome siþþan gewat to ðam lifigendan Drihtne þe he on life wurðode . Eugenia hæfde ær þan asteald mynecena mynster mid mycelre gehealdsumnysse , and seo modor Claudia hit micclum gegodode ; and hi þær bebyrgdon þone";bisceop;Philippum . And hi siþþan ealle endemes færdon , seo modor and seo dohtor , to ðære mæran Rome byrig , and ða gebroðru samod , Særgius and Auitus . And þa romaniscan wytan hi wel underfængon , and for þære ealdan cyððe þæs æðelan Philippes . Þa gesætton þa;
38;cwæð eft se halga wer to ðam ealdan smyðe , Witodlice he wunað nu on Wincelcumbe hamfæst , and ic ðe nu halsige on þæs hælendes naman þæt ðu him min ærende ardlice abeode , and sege him to soþan þæt Swiðun se bisceop het þæt he fare to Aþelwolde;bisceope;, and secge þæt he geopenige him sylf mine byrgene , and mine ban gebringe binnan ðære cyrcan , forðan þe him is getiþod þæt ic on his timan beo mannum geswutelod . And se smið him cwæð to , La leof , Eadzige nele gelyfan minum wordum . Ða;
39;eallum hys hæsum mid micelre eadmodnysse , and eode innto cyrcan , læg on þære flore eallum limum astreht , and beot hys breost , biterlice wepende , and bæd hym miltsunge hys misdæda æt Gode , and gestod þa mæssan mid oðrum mannum . We magon wundrian þæs mæran;bisceopes;", and hys anrædnyss is swyðe heriendlic , and þæs caseres eadmodnyss eac þartogeanes is swiðe micel , þæt he mihte swa forberan on swylcum anwealde þæt he wære amansumod ; ac seo eadmodnyss hym becom to ecere hæle . </doc><doc filename=coaelhom.o3 period=o3 shorttitle=ÆHom_3> Ure Drihten sæde oft swiðe digle bigspell ; þa on";
40;"earmum mannum is inngang alyfed innto Godes cyrican God to gebiddanne , and ic ne mot nu gan innto Godes huse ; and eac þartoeacan me is heofon belocen . Þis he cwæð mid siccetunge and mid sarlicum wope . Ða cwæð Ruphinus þæt he yrnan wolde to þam halgan";biscope;, and hine georne biddan þæt he unbunde þone bend þe he gewrað . Þa cwæð se casere , ic cann hyne swa geare þæt he nele awendan Godes rihtwisnysse for minum cynedome to nanre wohnysse . Hi eodan swaþeah begen to þam biscope sona , and fundon hine sittende;
41;"ege eadmodlice him to , Gewit fram me , Drihten ; ic eom synfull man . Nolde se Hælend for his bene swaþeah hym fram gewitan , ac wunode mid hym , oððæt hy to lande gelændon mid ealle , for ðan þe ða lareowas þe Godes folc lærað ,";bisceopas;and mæssepreostas , ne moton forlætan þa halgan Godes wican þe God hym betæhte for nanre costnunge , for ðan þe Crist hy ahret , gif hy for his lufan ne forlætað his heorde . He wæs swiðe afyrht , and his geferan ealle , and Iacob , and Iohannes;
42;"feorðan dæg het se foresæda dema gelædan ðone halgan on heardre racenteage , feorr on wræcsið ferigende on scipe . Þær wæs sum æðelboren man , atelice hreoflig ; þa axode se bisceop , wylt ðu beon hal ? He cwæð , ic wylle ; and him andwyrde se halga";bisceop;", Gelyf on hælend Crist ; and se hæðena him andwyrde , gif he me gehælð he bið min hælend God . Appollonaris ða hrepode þone untruman hreoflian on ðæs hælendes naman , and he wearð hal sona , mid þam ðe he clypode Cristes naman him to fultume .";
43;feowertyne þusenda mid færlicum bryne , oððæt Aaron eode ut of ðam getelde mid his storcyllan , and stod him tomiddes , gebæd ða for hi , and se grama geswac . On ðysum mæg gehyran se ðe hæfð ænig andgyt þæt hit byð swyðe hearmlic þam ðe huxlice tælð;bisceopas;and sacerdas , þe syndon Godes bydelas , and to lareowum gesette to lærenne Godes folc , þonne se lareow him segð Godes gesetnyssa and his beboda , him sylfum to þearfe , and he þonne forsyhð , and to forsewennysse hæfð ge þone Godes bydel ge þa Godes beboda;
44;flæsc , swa þæt hi nellað onbugan ðam bysmorfullum leahtrum , ne ðam yfelum gewilnungum , ac winnað him togeanes oð þæt hi sigefæste siðiað to Criste , and to ðam ecan wuldre for ðam sceortan gewinne , and hi blyssiað on ecnysse bliðe mid Criste . Agustinus se snotera;bisceop;sæde eac on sumere bec , Mine gebroðra þa leofestan , gelome ic eow warnode , and mid fæderlicre carfulnysse , ic eow cuðlice manode þæt ge andsætan wiglunge þe unwise men healdað , mid ealle forlætan swa swa geleaffulle men , forðan butan ic eow warnige , and þone;
45;forþearle þæt hi swa lange folgodon swa fulum hlafordum , and gebugon þa to Gode , to his clænum biggengum . Git we willað secgan be sumum leasum gode , þe æfter Cristes menniscnysse þurh Cristes geleafan eaðelice wearð of his anlicnysse adræfed . Gregorius wæs gehaten sum swiðe halig;biscop;", se worhte miccle wundra and mihta þurh God . Se rad on wintres dæge embe sume neode ofer þa micclan muntas þe man Mundiu hæt , and ne mihte for snawe nahwider gecyrran þær he wicstowe hæfde ; ac þar wæs gehende an hæþen tempel , gehalgod þam gode";
