ID;leftContext;node;rightContext;truth
93;þa ðær wunode mid him on Rauenna byrig , and bodode geleafan , and manega gefullode ðæs folces meniu . Manega eac befæstan syððan hi gefullode wæron , heora cild to lare þam soðfæstan bydele , and Godes geleafa ðær weox , and wanode se hæðenscype . Hwæt se halga;bisceop;þa on ðære byrig wunode ða twelf gear fullice , and gefullode þa leode , and gelome heom mæssode , and mæssepreostas gehadode , and diaconas , and clericas , and dæghwamlice mid him Godes lof gefylde mid gastlicum sangum . On ðære byrig wæs sum þegn Bonifacius gehaten ,;
94;þam niwan geweorce , com se arwurða Swyðun to sumum gelyfedan smyðe , on swefne æteowiende wurðlice geglencged , and ðas word him cwæð to , Canst þu ðone preost þe is gehaten Eadzige , þe wæs of ealdan mynstre mid ðam oðrum preostum adræfed for heora unþeawum þurh Aðelwold;bisceop;? Se smið þa andwyrde þam arwurðan Swyðune þus , Gefyrn ic hine cuðe , leof , ac he ferde heonon and ic nat to gewissan hwær he wunað nu . Þa cwæð eft se halga wer to ðam ealdan smyðe , Witodlice he wunað nu on Wincelcumbe hamfæst ,;
95;þe gescylt his gecorenan . To hire twam cnihtum he cwæð þæt hi heoldan æþelborennyss on mode , þeah þe hi mannum þeowdon , and cwæð þæt hi Crist gespræce þysum godspellicum wordum , Ne hate ic eow na þeowan , ac ge synd mine freond . Þa bebead se;biscop;þam gebogenan mædene þæt heo swa þurhwunade on þam wærlicum hiwe , oþþæt hi on fante gefullode wurdon , and mynsterlicre drohtnunge dearnunge geþeodde . Eugenia þa wunode on þam mynstre mid wærlicum mode þeah þe heo mæden wære , mid hyre twam cnihtum , uncuð gehwam , And heold;
96;þe secge , þas deadan swat . Saga me hwilc sunu wræce ærest his fæder on hys moder innoðe . Ic þe secge , þære næddran sunu , for þam ðe seo moder ofsloh ær þane fæder , and þonne ofsleað þa bearn eft þa moder . Saga me hwilc;bisceop;wære ærest on þare ealdan æ ær Cristes tokyme . Ic þe secge , Melchisedech and Aaron . Saga me hwilc bisceop wære on þære niwan æ . Ic þe secge , Petrus and Iacobus . Saga me hwilc man witegode ærest . Ic þe secge , Samuel . Saga;
97;"þurh hine ; and he sona wearð hal beorhte locigende , se ðe seðe blind wæs geboren . Hi wundrodon þa ealle , and anmodlice cwædon þæt se wære soð God þe swylce wundra worhte ; and manega þa gelyfdon þurh ða mihte on God . Taurus þa brohte þone";bisceop;"digellice , of ðæs folces gehlyde to sumum his landa , and hine þær afedde feower gear mid wistum , syx mila fram Rauenna ; and hine sohton þa cristenan , and his lare hlyston mid geleafan georne ; and ealle ða untruman þe him oft to comon wurdon gehælede";
98;"þæt he hit wolde cyðan his hlaforde , and ne dorste swa ðeah hit secgan æt fruman , ærþan ðe he beþohte þæt him ðearflic nære þæt he ðæs halgan hæse forhule his hlaforde ; sæde þa be endebyrdnysse hwæt Swyðun him bebead . Þa onscunode se Eadsige Aðelwold þone";bisceop;and ealle ða munecas þe on ðam mynstre wæron , for þære utdræfe þe he gedyde wið hi , and nolde gehyran þæs halgan bebod , þeah ðe se sanct wære gesib him for worulde . He gebeah swa þeah binnan twam gearum to þam ylcan mynstre and munuc wearð;
99;þæt ænig man gesawe swylce wundra ahwær . Þa awæcnode se wer of þam wynsuman slæpe , and swyðe besargode þæt he geseon ne moste ne nan læncg brucan þæs beorhtan leohtes , þe he mid Swiðune hæfde ða gesewen . He aras swaðeah and swiðe hraðe ferde to Aþelwolde;bisceope;, and him eall þis sæde . Aþelwold þa asende sona to þam munecum of cyninges hyrede , and cwæð þæt hi sceoldon þone lofsang singan , swa swa he geset hæfde , and se þe hit forsawe , sceolde hit mid fæstene seofon niht on an swarlice gebetan .;
